{
  "schema_version": 1,
  "name": "vaws-coordinator",
  "repository": "vllm-ascend-workspace/vaws-coordinator",
  "url": "https://github.com/vllm-ascend-workspace/vaws-coordinator.git",
  "visibility": "public",
  "ref": "main",
  "commit": "d3c4e82a3c0e3f0be31727abf17b7863bcedba77",
  "root_env": "VAWS_COORDINATOR_ROOT",
  "default_checkout": "{shared_workspace_root}/.vaws-local/vaws-coordinator",
  "bootstrap": "python3 .agents/scripts/vaws.py bootstrap",
  "consumed_surface": {
    "task_stdio_server": "task_server.py",
    "task_cli": "scripts/vaws.py",
    "session_hook": "hooks/vaws_session.py",
    "http_manager": "server.py",
    "host_queue_interface": "lib/vaws_host_queue.py (VAWS_HOST_QUEUE_MODULE override; default is this checkout's host/vaws_npu_coordination.py)",
    "host_queue_module": "host/vaws_npu_coordination.py",
    "build_inputs": "lib/vaws_build_inputs.py"
  },
  "identity": {
    "required_files": [
      "task_server.py",
      "scripts/vaws.py",
      "hooks/vaws_session.py",
      "lib/vaws_ops.py",
      "lib/vaws_agent_session.py",
      "lib/vaws_task_client.py",
      "workers/managed_jobs.py",
      "server.py",
      "host/vaws_npu_coordination.py",
      "service-api.json"
    ],
    "canonical_origin": true
  },
  "note": "vaws-coordinator is consumed as an external checkout, not a submodule and not a vendored copy. Locate it through VAWS_COORDINATOR_ROOT or the default path above. Bump `commit` deliberately; `vaws.py status` reports drift. This pin is the independently accepted merged main. It does not change the remote-dev pin in remote-dev.json. identity.canonical_origin is true so a fork is reported as wrong_origin (usable, always warned). false would drop origin from identity and never emit wrong_origin.",
  "extensions": {
    "tree": "d3f91bc6375a876fc01d46b1835feabd61db2729",
    "pinned_mirrors": {
      "vaws_build_inputs": {
        "scaffold_path": ".agents/lib/vaws_build_inputs.py",
        "coordinator_path": "lib/vaws_build_inputs.py",
        "sha256": "967adeb699e47de2e281581d576a69f6c85075385975e42916ead1ed198a2e09",
        "why": "Parity build keys must stay byte-identical to the coordinator verifier. Pure schema/helper; not a second task-state writer."
      }
    },
    "arrival_blobs": {
      "lib/vaws_agent_session.py": "5b442938c5f501dd33478fc38280e54d9f4a0ba4",
      "lib/vaws_task_client.py": "bf60a9305e72401ac6aa162b8acad54b0c509696",
      "lib/vaws_ready_runtime.py": "3d2505149e880554556f389390f708aeb42a671d",
      "lib/vaws_managed_execution.py": "f29b2c3d40e135f24a742680f655a1b01ab04469",
      "lib/vaws_runtime_profile.py": "14e0e0e9afd7171119f8f3d09472f69488235b51",
      "lib/vaws_ops.py": "ec175c382edfe0baf0806b0f3572f572c1d35ff6",
      "lib/vaws_build_inputs.py": "426c97a47de22d110b2e827257fc79eeba544d85",
      "task_server.py": "f59a9a8cde60193b10d6ddda3ef4a43b5fe337fe",
      "scripts/vaws.py": "c712c200aeab867f217ea069f6a670a513dc108b",
      "hooks/vaws_session.py": "8e9b796b3dd98c65666bd465f748eb7cfcce6b58",
      "workers/managed_jobs.py": "ddb6811c4d28d5add31973e4bf8731909b0a9783",
      "server.py": "5ef90b623518ce67ffc43219b2c28b60d2a27306",
      "host/vaws_npu_coordination.py": "00f81e8300717307da06556f7c2cbdebf6b14ed7",
      "service-api.json": "d35eb43e51820bc60857adf68b960da5b51fc5b8"
    },
    "client_setup_constraint": "The coordinator JSON helper rewrites command/args/type for same-name providers; TOML preserves them. This scaffold must not apply that helper as a migration that claims to preserve user-managed entries."
  }
}
